descripcion,precio,titulo,ubicacion
"CRIBOSOL 30-10-10:,Es un fertilizante para todos los suelos y cultivos, plantas ornamentales, hortalizas, flores, césped, árboles frutales. Es de acción rápida para aplicaciones en cobertera. El Nitrógeno es absorbido por las raíces lo que acelera el desarrollo del cultivo y fortifica la planta, haciéndola resistente a las enfermedades y pestes. ,ANÁLISIS:,Nitrógeno: 30%,Fosforo: 10%,Potasio: 10%,PRESENTACIÓN,Funda de un Kilo: USD 3,50 más costo de envío,CRIBOS INDUSTRIAS tiene más de 56 años en la industria agrícola. Cumplimos con los estándares de calidad y comercializamos con los registros respectivos que dicta la ley. Consulta nuestra gama de productos: Semillas, abonos orgánicos, bomba a motor, insecticidas, raticidas.,Gracias por su interés.",3,"Fertilizante Cribosol 30-10-10, Abono Para Plantas",Riobamba
"Rastra agrícola de levante INDAGRO de 20 discos, con los mejores acabados del mercado, materiales de alta calidad y resistencia garantizando durabilidad, discos de 24"" de la mejor calidad chumaseras engrasables de rodamiento, cuerpos de 11"" de separación con tornillos reguladores para trabar y destrabar cuerpos y torre con tornillo para regulación.",6.000,Rastra Agricola De Levante Indagro,Montúfar
"Boquilla neumática con TEE 8MM para instalar en tuberia 8mm, ideal cabinas de desinfección.,descontamizacion,sanitizacion,instalación en autobuses,presión de trabajo hasta 140psi,tasa de flujo 80-145ml / min,tamaño de las gotas de niebla es de aproximadamente 30 micras,Rango de pulverizacion 0.6m.",7,Boquilla Aspersor Cabinas Autobuses Taxi Uber Riego Agricola,Cuenca
"*SOMOS GANAGRO TECNOLOGÍA AGROPECUARIA*,ABONO COMPUESTO 15-15-15,El uso de los fertilizantes compuestos significa un adecuado uso de técnicas de fertilización; una vez conocidas las necesidades de nutrientes de los cultivos en cuanto a N-P-K-Mg-S se refiere. La tendencia actual es de darle a la planta la mayor cantidad de nutrientes en una sola aplicación, de una manera balanceada.,Estas formulas se ajustan a las necesidades de diferentes cultivos, deficiencias del suelo, eficiencia del fertilizante, etc. Las nuevas formulas contienen Magnesio, Azufre, que también son macroelementos de fundamental importancia.,El Nitrógeno en los Vegetales (N),Estimula el rápido crecimiento, da un color verde intenso a las hojas y mejora su calidad.,Aumenta el contenido de proteínas, la producción de frutos y semillas.,Es nutrimento de los microorganismos del suelo.,El Fósforo en las Plantas (P),Estimula el desarrollo precoz de las raíces y el crecimiento de la planta.,Desarrollo rápido y vigoroso de las plantas jóvenes.,Estimula la formación de flores y la maduración de los frutos, es indispensable en la formación de la semilla.,El Potasio en las Plantas (K),Le importe a la planta vigor y resistencia a las enfermedades.,Evita la caída o volcamiento de las plantas conjuntamente con el Ca y el Mg.,Ayuda a soportar condiciones adversas, como la falta de la humedad del suelo.,Favorece la formación, transporte y acumulación de azucares y almidones.,El Magnesio en los Vegetales (Mg),Sin Mg no hay fotosíntesis, ocupa la molécula central de la clorofila.,Sirve como elemento estructural en las membranas celulares.,Las necesarias aplicaciones de K reducen la capacidad de la planta de absorber Mg. (son Antagónicos).,El Azufre en los Vegetales (Z),Permite un crecimiento más activo de las mismas.,Ayuda a mantener el color verde intenso de las hojas.,Activa la formación de nódulos en las leguminosas.,Presentación:,Saco 50kg.",24,Abono Fertilizante Compuesto Triple 15 50kg,Quito
"Abono fertilizante para cactus y suculentas,SMART CACTI – Alimento para plantas. ,Ideal para cactus, crasulas, suculentas y plantas carnívoras. ,Fertilizante de muy fácil aplicación, se pone directamente en la tierra antes de regar la planta. Puede usarlo una vez por semana en plantas débiles y cada dos o cuatro semanas para mantenimiento. ,Toda la belleza de terrarios y decoraciones estará en su punto máximo con este abono. ,Fertiliza de forma instantánea liberando los nutrientes en el momento que pone agua.,---------------------------------------------------------------------------------------------------------,Nuestro local de entrega en Quito está en el sector de la Floresta. Hacemos envíos a todo el país vía correo certificado (entrega en 24 horas) 2usd en Quito y 3.9usd en otras ciudades del Ecuador.,Recuerde que MascotaModa es una compañía limitada regida por la superintendencia de compañías. Puede hacer su compra con tranquilidad y confianza. Somos MercadoLideres.,Aceptamos efectivo, deposito o transferencia banco del Pichincha.,Aceptamos todas las tarjetas en corriente y diferido.,NO DUDE EN HACER SUS PREGUNTAS",4,Abono Fertilizante Para Cactus Suculentas Y Terrarios,Quito
"PRECIO INCLUYE IVA ,Medicador Dosificador Automático Pecuario Avícola Agrícola,El equipo GATOR-XL es un dosificador hidráulico, que usa un pistón cuya función principal es la de dar mayor precisión al momento de dosificar y también le da una mayor vida útil al equipo, cuenta con un sistema by pass el cual evita que la solución química pase por el motor, y de esta manera no dañarlo por los diversas soluciones que se usan a diario en la producción avícola, además, resiste presiones de hasta 400 PSI; es de fácil reparación por su diseño modular, con el Gator el 90% de los problemas se puede corregir en campo sin necesidad de sacarlo de granja para llevarlo hacer mantenimiento.,GATOR-XL cuenta con un filtro autolimpiable de 104 micras, protegiendo al equipo de impurezas para que la solución a dosificar sea efectiva.,El Gator-XL es la opción mundial para agregar proporcionalmente cualquier solución a un sistema de agua para ganado,avícola , agricultura, horticultura, saneamiento, tratamiento de agua, etc.,Accionado por presión del agua,Diseñado para un mantenimiento simple y de bajo costo.,Capaz de manejar una amplia variedad de productos químicos.,Hecho de trabajo pesado, construcción modular, con un motor de agua separado y una sección de bomba química, para que el motor se mantenga libre de químicos, y las partes sean de fácil acceso para el servicio.,Se instala fácilmente en el sistema de tuberías con mangueras flexibles o se puede instalar directamente en el sistema de tuberías con los conectores de unión opcionales.,Especificaciones de Gator-XL ™:,Presión máxima: 120 psi,Presión mínima de trabajo: 3 PSI,Caudal máximo: 600 GPH,Caudal mínimo: 2 GPH,Proporción de alimentación química: 1: 128",295,Medicador Dosificador Automático Pecuario Avícola Agrícola,Quito
"BOMBA DE DIAFRAGMA 12VOLTIOS IDEAL SISTEMAS DE RIEGO, INVERNADEROS, TUNELES Y CABINAS DE DESINFECCION, AUTOBUSES, AUTOMOVILES.,6L/Min 130 PSI , Bomba de Diafragma de Alta Presión de Agua Barco de Caravana etc.,Características:,1. La bomba de diafragma combina las ventajas de la bomba autoaspirante y la bomba química. Instalado en un lugar seco y bien ventilado,2. Utilizando una variedad de materiales importados resistentes a la corrosión, autocebantes, protección térmica, operación suave, marcha en vacío continua de larga duración, operación de carga continua a largo plazo.,3. Totalmente sellado, presión estable.,4. Soporte de goma puede absorber la vibración de la bomba cuando se trabaja.,5. Cuando la presión del agua es demasiado alta, la bomba se protegerá a sí misma y al trabajo normal, las tuberías de agua no estallarán, es seguro y duradero.,6. Protección de presión: protección de potencia del interruptor de presión.,7. El flujo máximo de 6 L / min, la velocidad de flujo es estable.,La presión máxima 130 PSI (9,0 kg) de presión se puede ajustar a partir de 75 PSI (5 Gongjin) -130 PSI (9,0 kg) según las diferentes necesidades. (NOTA IMPORTANTE: la presión se ajusta de manera segura desde los 75 PSI, y de manera externa ya que la bomba tiene presión fija),8. El trabajo: servicio intermitente.,9. El uso de medios: agua o solvente PH valor 5--8, aceite.,Vida de servicio: más de 500-1000 horas de trabajo continuo.,10. Características del tipo de interruptor de presión: cuando la bomba se tapa o aumenta la presión de trabajo normal la bomba se bloquea y se desactiva como método de protección, cuando la presión o tubería se libera la bomba vuelve a activarse y trabaja normalmente.,Especificación:,Voltaje: 12V,Amperios: 6A,Potencia: 70w,Presión: 0.90MPA(MAX 130PSI),Flujo: 6L / min,Temperatura del medio: 0 grados - 75 Celcius,Tamaño de entrada y salida: 10mm,Tamaño: 16.5 x 10 x 6.2 cm,Peso: 598g,Aplicación:,* Agricultura/Yate/RV/Sistema de agua presurizada de caravanas/ Food track / Ambulancias / casas rodantes y para la industria.,* Pulverizador (en vehículo, eléctrico de batería, pulverizador manual),* Llenado de líquidos y bebidas y transferencia de bebidas,* Sistemas presurizados.,*Consulte sin compromiso si su aplicación es compatible con este dispositivo.,Función especial:,*Rendimiento estable,*Autocebante, interruptor automático,*Bajo nivel de ruido, resistente a la corrosión externa.,*Ciclo de trabajo: trabajo intermitente",65,"Bomba De Diafragma Cabinas, Boquilla, Tuneles Riego Agricola",Cuenca
"GANAGRO TECNOLOGIA AGROPECUARIA.,Cada día innovando la agricultura,DESCRIPCION:,Siembra y fertiliza a la vez,Es manual,liviana y fácil de usar ,Tiene un rendimiento de siembra de una hectárea día,Viene con un kit de discos para los diferente tipos de semillas como maíz, alverja,fréjol etc.,Es regulable para diferentes distancias de siembra,Profundidad de siembra de 5 cm con constante garantizando su germinación uniforme,Estamos ubicados en el Quinche y nuestra sucursal en Pifo,Realizamos envíos a nivel nacional.,EMPAQUE:,1 Sembradora con Fertilizante,1 kit de discos para semillas",210,Sembradora Manual Con Fertilizante Hortalizas Huerto,Quito
"Fertilizante para desarrollo y crecimiento jardinería,SMART GRO - Enriquecido con 10 nutrientes.,Favorece y acelera el crecimiento de huertos. ,Composición 24 - 8 - 16 N P K,Su alto contenido en Nitrogeno proporciona a los vegetales un rápido crecimiento. ,Se usa casa 7 a 14 días en sus plantas y cultivos. Fertiliza de manera instantanea. ,Promueve resultados rápidos y satisfactorios. ,Es seguro para todo tipo de plantas, usado en las cantidades recomendadas no produce quemaduras.,Es un fertilizante soluble en agua. ,Para plantas de interior debe poner media cucharaduita 2.5ml de SMART BLOOM en 1 litro de agua.,Para plantas de exterior debe poner una cucharaduita 5ml de SMART BLOOM en 1 litro de agua.,Con esta mezcla riega sus plantas y eso es todo. Los resultados son muy rápidos.,--------------------------------------------------------------------------,Nuestro local de entrega en Quito está en el sector de la Floresta. Hacemos envíos a todo el país vía correo certificado (entrega en 24 horas) 2usd en Quito y 3.9usd en otras ciudades del Ecuador.,Recuerde que MascotaModa es una compañía limitada regida por la superintendencia de compañías. Puede hacer su compra con tranquilidad y confianza. Somos MercadoLideres.,Aceptamos efectivo, deposito o transferencia banco del Pichincha.,Aceptamos todas las tarjetas en corriente y diferido.,NO DUDE EN HACER SUS PREGUNTAS",5,Fertilizante Smart Gro Crecimiento Huertos Y Jardines,Quito
"Combo de 6 kilos cuesta 25 dólares ,Y de 14 kilos cuesta 35 dolares ,Hacemos envíos",25,Combo Acero Herramienta Agro Agrícola Grande Desde 6 A 14 Ki,Quito
"Tenemos para Ud, Azufre S500 para el área agrícola y para la industria:,Presentación: Sacos x 25kg,1. DESCRIPCIÓN: Es un polvo seco obtenido a partir de azufre de origen petroquímico, lo que garantiza un producto libre de metales,pesados, con un alto contenido en pureza.,2. CARACTERÍSTICAS ,NOMBRE COMERCIAL: AZUFRE PANTERA S-500,PESO MOLECULAR: 32.065g/mol,APARIENCIA: POLVO DE COLOR AMARILLO,3. APLICACIONES:,Tiene aplicaciones en el campo industrial para vulcanización del caucho, agrícola, en pirotecnia, etc.,4- CONDICIONES DE ALMACENAJE,Colocar sobre pallets, en lugar fresco y bajo techo. Evitar cercanía al fuego, materiales oxidantes e instalaciones,eléctricas en mal estado,Para acceder a nuestros datos de contacto por favor acepte la compra y llámenos o escríbanos a nuestro Whatsapp,Realizamos envíos a todo el país.!!",20,Azufre Puro S500 / Industria / Agricola / 25 Kg,Guayaquil
"HUMUS DE LOMBRIZ ROJA CALIFORNIANA.,El humus de lombriz es un abono orgánico 100% natural, que se obtiene de la transformación de residuos orgánicos compostados, por medio de la Lombriz Roja de California. Mejora la porosidad y la retención de humedad, aumenta la colonia bacteriana y su sobredosis no genera problemas. Tiene las mejores cualidades constituyéndose en un abono de excelente calidad debido a sus propiedades y composición.,La acción de las lombrices da al sustrato un valor agregado, permitiendo valorarlo como un abono completo y eficaz mejorador de suelos. Tiene un aspecto terroso, suave e inodoro, facilitando una mejor manipulación al aplicarlo, por su estabilidad no da lugar a fermentación o putrefacción.,El humus de lombriz es un abono rico en hormonas, sustancias producidas por el metabolismo secundario de las bacterias, que estimulan los procesos biológicos de la planta.,El humus de lombriz resulta rico en elementos nutritivos, rindiendo en fertilidad 5 a 6 veces más que con el estiércol común.,Procedencia: Estadounidense.,BOLSA DE 1 KILO.,También disponemos en presentación por bultos.. ,Puede acercarse a nuestra tienda o también se realiza envíos dentro de Quito y a cualquier parte del Ecuador sin ningún inconveniente.,Para mayor información puede hacer cualquier pregunta o hacer click en comprar para contactarnos de mejor manera.. Sin ningún compromiso!!",1,Humus De Lombriz Fertilizante Abono Para Plantas Por 1 Kilo,Quito
"AgronaturalizaEC somos una empresa de microbiologos desarrolladora,y comercializadora de insumos agricolas organicos y biologicos.,Biol Fertilizante Abono Premium,Elaborado con altos estándares de calidad, 1 litro de biol concentrado,sirve para preparar 10 litros de biol y posteriormente aplicar al cultivo.,El litro tiene un valor de 3,50 dólares,El Galon tiene un valor de 12 dólares,Cualquier pregunta con gusto le responderemos.",3,Biol Fertilizante Abono,Quito
"Boquilla , ideal Arcos de Vehículos,Sanitizacion,instalación en autobuses,Orificio 3mm,presión de trabajo hasta 150psi,Rango de pulverizacion hasta 3 metros",12,Boquilla Agricola Aspersor Arcos De Desinfección Riego Fruta,Quito
,61,Librol Agricola Tecnologia Limpia De La Granja Integral +dvd,Quito
"PRODUCTO 100% NUEVO CON FACTURA Y RESPALDO DE GARANTIA DE LA MARCA CON TALLERES TECNICOS Y REPUESTO EN TODO.,SI USTED ES DE GUAYAQUIL O DURAN LA ENTREGA ES A DOMICILIO SIN RECARGO ALGUNO DENTRO DEL PERIMETRO URBANO O PODEMOS HACER PUNTO DE ENTREGA EN UN LUGAR PUBLICO SEA EN UN SHOPPING O TERMINAL TERRESTRE.,SI USTED ES DE OTRA CIUDAD SI REALIZAMOS ENVIOS A NIVEL NACIONALTODO EL PAIS INCLUIDO GALAPAGOS EL FLETE PUEDE SER CORTESIA DE LA EMPRESA O UN MININO VALOR ADICIONAL TRABAJAMOS CON TRANSPORTES ECONOMICO Y SEGUROS PARA CONFIANZA DE LOS CLIENTES DAMOS TODAS LAS GARANTIAS PARA QUE RECIBA SU PRODUCTO EN SU CIUDAD.,SOMOS EMPRESA LIDERES EN VENTA POR INTERNET 10 AÑOS CON REPRESENTACION DE 60 MARCAS EN PAIS MAS DE 15 MIL ARTICULOS ENTRE MAQUINARIAS Y HERRAMIENTAS (DOMESTICAS, COMERCIAL, PROFESIONAL, INDUSTRIAL, AGRICOLAS, ETC....),SOLO SI TE INTERESA EL PRODUCTO DA CLIK EN COMPRAR PARA PODER COORDINAR ENTREGA U ENVIO COMPRA SERIA Y CALIFICABLE.,ANTES DE COMPRAR RECUERDE,- La compra es un compromiso serio, realice todas las preguntas necesarias antes de efectuarla.,- Una vez realizada la compra se espera que la transaccion se concrete dentro de los proximos 5HORAS O MAXIMO 5 dias",130,Manguera De Riego Plana Agricola 2pulgadas Rollo 100 Metros,Guayaquil
"Abono fertilizante bioprotector para BONSAI,NIKKO – Alimento Y BIO PROTECTOR para bonsai. ,NIKKO permite tener BONSAI vigorosos sin acelerar el crecimiento. Siempre sanos, y resplandecientes. ,Contiene los nutrientes necesarios para para el crecimiento y desarrollo vegetal. Bio estimulantes que dan un óptimo funcionamiento metabólico.,Protege y combate contra pulgones, afidos, trips, acaros, e insectos en general de cuerpo blando. ,Adicionalmente protege contra enfermedades, aumenta la inmunidad del bonsai, evita ataques de hongos.,Formulado por BIOTECH en USA, es un producto que contiene, macro y micro nutrientes bio estimulantes botánicos.,Se aplica sobre las hojas de la planta y en pocos días ve los resultados. Presentación 500ml con aplicador incluido y sello de origen.,Se recomienda usarlo dos veces por mes.,---------------------------------------------------------------------------------------------------------,Nuestro local de entrega en Quito está en el sector de la Floresta. Hacemos envíos a todo el país vía correo certificado (entrega en 24 horas) 2usd en Quito y 3.9usd en otras ciudades del Ecuador.,Recuerde que MascotaModa es una compañía limitada regida por la superintendencia de compañías. Puede hacer su compra con tranquilidad y confianza. Somos MercadoLideres.,Aceptamos efectivo, deposito o transferencia banco del Pichincha.,Aceptamos todas las tarjetas en corriente y diferido.,NO DUDE EN HACER SUS PREGUNTAS",5,Abono Fertilizante Y Bioprotector Para Bonsai,Quito
"ASEGURA TU PRODUCCIÓN, FERTILAYA S.A. UNA EMPRESA CON 4 AÑOS DE EXPERIENCIA ENFOCADA AL BIENESTAR Y SOSTENIBILIDAD DEL AGRICULTOR ECUATORIANO. ,Brindamos soluciones y alternativas de bioinsumos 100% orgánicos. ,TRICOLAYA (TRicho+Humus) presentaciones:,500 mL: 7,1L: 11, 4L :35, 20L: 120,Devuelve la vida microbiana benéfica a tus suelos, además aporta con macro y micro nutrientes, ácidos húmicos y fúlvicos, que tus cultivos necesitan para estar saludables y obtener las mejores cosechas. Además contiene esporas de Trichoderma sp, un fúngicida y protector de las raíces de tus cultivos.,ASEGURA TUS CULTIVOS CON BIOINSUMOS DE CALIDAD.",7,"Fertilizante Orgánico Fungicida Humus, Trichoderma",Quito
"*SOMOS GANAGRO TECNOLOGÍA AGROPECUARIA*,CARACTERÍSTICAS:,Utilizado para el proceso de injerto de flores y plantas, abriga la rama de una planta a otra planta que les permitan crecer como una. no da ningún daño a la parte injertada de la planta. conveniente para los injertos de frutas, flores y hortalizas.,Impermeable, flexible y escalable,Auto-adhesivo, Suave que se extiende,Biodegradación de alta calidad al sol.,Especificación:,Longitud: 100 m,Ancho : 2.7 cm,Color: Blanco,Material: Plásticos agradables,EMPAQUE:,1 Cinta de injerto 100 metros.",2,Cinta Plástica Injertacion Plantas Agrícola,Quito
"Boquilla neumática con con conexión de 1/2 para instalar en tubo pvc, ideal cabinas de desinfección.,descontamizacion,sanitizacion,presión de trabajo hasta 140psi,tasa de flujo 80-145ml / min,tamaño de las gotas de niebla es de aproximadamente 30 micras,Rango de pulverizacion 0.6m.",7,Boquilla Aspersor Riego Hortalizas Tomate Fumigar Agricola,Cuenca
"GANAGRO TECNOLOGÍA AGROPECUARIA,Transportadora de plántulas de vegetales, hortalizas y de jardín.,DESCRIPCIÓN:,Este plantador de plántulas de hortalizas puede ayudarlo a plantar sus plantas de tulipanes, tomates, papas, plantas herbáceas y hortalizas sin agacharse,Hecho de acero inoxidable de alta calidad, la sembradora es duradera y resistente a la corrosión,Cavar hoyo, rellenar el agujero, romper la película de mantillo, plantar la plántula al mismo tiempo,Fácil de usar, solo empujar, apretar y jalar, puede terminar todos los procedimientos sin agacharse,Con esta herramienta de trasplante conveniente, puede guardar su espalda y mucho tiempo,EMPAQUE: 1 Transplantadora",75,Transplantadora Sembradora De Plantulas Maquinaria Agrícola,Quito
"LA CASA DE LAS MANGUERAS FM,SOMOS IMPORTADORES Y DISTRIBUIDORES DE EQUIPOS Y ACCESORIOS DE RIEGO , ,MANGUERA DE SUCCIÓN AGRÍCOLA DE 2 Y 3 PULGADAS PARA BOMBA DE AGUA VIENE EN PRESENTACIONES DE ROLLO DE 32M, ,Disponemos de todos los accesorios necesarios, bombas, manguera de succión, válvula de pie de bronce o PVC, acoples fijos o acoples rápidos, abrazaderas, etc. etc., ,PRECIOS:,• Manguera succión de 2” 2,69/Metro. 86,08 / Rollo,• Manguera succión de 3” 4,75/Metro. 152,00 / Rollo,• Válvula de pie PVC de 2” 4,50 ,• Válvula de pie PVC de 3” 16,50 ,FORMAS DE PAGO:,· En efectivo, depósito bancario, transferencia., ,FORMA DE ENTREGA:,· La entrega se realiza en nuestro local. Envíos se realiza por transporte o Courier a elegir por el comprador quien asumirá los costos de envío.",2,Manguera Succion Agricola De 2 Y 3 PuLG / Rollo 32m P/ Riego,Latacunga
"Abono 100%orgánico a base de pulpa de café. 0,75 centavos",1,Abono Orgánico De Café ,Santo Domingo
"Bionutriente orgánico,¿Qué es? Es un fertilizante liquido de origen vegetal y animal que se descompone de,una digestión anaeróbica, dicha digestión se realizar en un biodigestor totalmente,hermético con el fin de convertir la materia orgánica en fertilizante. ,¿Ventajas? Una de las grandes ventajas es que se adapta a cualquier cultivo, en,cualquier etapa de ciclo productivo, no es toxico y tiene un costo bajo en comparación a,productos similares en el mercado.,¿Carga microbiana? El método de preparación incluye un biodigestor que trae,su propio cultivo de bacterias, al ser un sistema hermético y anaeróbico las bacterias que,no puedan degradar materia vegetal o animal deben incurrir en el canibalismo. Este plus,hace que su carga microbiana actúe como control biológico para insectos chupadores del,tipo mosca blanca, áfidos, ácaros, pulgón etc. ,El fertilizante posee nutricionalmente macro y microelementos,,su proporción balanceada y pH neutro hace que se pueda absorber fácilmente por todos,los cultivos en aplicaciones bajo el esquema drench (raíces) y bajo aplicaciones foliares,(follaje).,Dosis:,Pastos: 12 L/ ha 2 aplicaciones en el ciclo productivo.,Frutales: 8 L/ha 3 aplicaciones cada 20 días después de poda.,Banano: 8 L/ha fumigaciones en avioneta; 12L/ha fumigaciones con moto bomba.,Hortalizas: 9 L/ha 3 aplicaciones en todo el ciclo productivo.,Melón/Sandia: 7 L/ha 3 aplicaciones en todo el ciclo productivo.,Papa: 10 L/ha 2 aplicaciones en todo el ciclo productivo.",4,Bionutriente Organico ,Quito
"Fertihumus plus es un fertilizante orgánico liquido de alto rendimiento, es un potente bioestimulador que mejora el crecimiento foliación floración y fructificación de tus plantas, también mejora la inmunidad de las plantas ante enfermedades y plagas.",15,Humus Liquido Premium Fertihumus Plus 4 Litros,Quito
"Sal de potasio del Acido humico fulvico de alto grado de leonardita, contiene grupo hidroxilo, carboxilo y otros activos. Tiene la funcion de intercambio ionico, de absorcion, quelante, complejante, que permiten a los micronutrientes no ser bloqueados en el suelo.",10,Germizol,
"Bionutriente orgánico,¿Qué es? Es un fertilizante liquido de origen vegetal y animal que se descompone de,una digestión anaeróbica, dicha digestión se realizar en un biodigestor totalmente,hermético con el fin de convertir la materia orgánica en fertilizante. ,¿Ventajas? Una de las grandes ventajas es que se adapta a cualquier cultivo, en,cualquier etapa de ciclo productivo, no es toxico y tiene un costo bajo en comparación a,productos similares en el mercado.,¿Carga microbiana? El método de preparación incluye un biodigestor que trae,su propio cultivo de bacterias, al ser un sistema hermético y anaeróbico las bacterias que,no puedan degradar materia vegetal o animal deben incurrir en el canibalismo. Este plus,hace que su carga microbiana actúe como control biológico para insectos chupadores del,tipo mosca blanca, áfidos, ácaros, pulgón etc. ,El fertilizante posee nutricionalmente macro y microelementos,,su proporción balanceada y pH neutro hace que se pueda absorber fácilmente por todos,los cultivos en aplicaciones bajo el esquema drench (raíces) y bajo aplicaciones foliares,(follaje).,Dosis:,Pastos: 12 L/ ha 2 aplicaciones en el ciclo productivo.,Frutales: 8 L/ha 3 aplicaciones cada 20 días después de poda.,Banano: 8 L/ha fumigaciones en avioneta; 12L/ha fumigaciones con moto bomba.,Hortalizas: 9 L/ha 3 aplicaciones en todo el ciclo productivo.,Melón/Sandia: 7 L/ha 3 aplicaciones en todo el ciclo productivo.,Papa: 10 L/ha 2 aplicaciones en todo el ciclo productivo.",4,Bionutriente Organico ,Quito
"Abono 100% Organico,Nitrógeno : 4.5%,Fósforo : 1.4%,Potasio : 3.0%,Análisis Garantizado",4,Abono Orgánico De CodornizCodornazaPresentación: 12kg,
